{"schema_version":"audit-report-v1","contract_version":"1.0.0","verification_status":"verified","open_issues":[],"audit":{"id":"AUDIT-ROBOT-001","work_order_ids":["WO-ROBOT-DT"],"simulation_ids":["SIM-ROBOT-DT"],"scope":"End-to-end audit of JOB-ROBOT-001 through skill, curriculum, work order and offline simulation artifacts","status":"APPROVED","findings":[{"id":"FIND-ROBOT-001","category":"robotics","severity":"low","hazard":"未经授权连接真实执行器的风险","evidence":["SIM-ROBOT-DT runtime isolation_mode=offline","SIM-only PLC addresses","WO safety controls"],"control":"保持离线隔离并由教师放行；真实硬件接入需另行授权审计","disposition":"accepted"}],"regulatory_checks":[{"reference":"MOHRSS/MOE vocational standard","version":"test-2026","requirement":"岗位能力、安全操作和可评价证据可追溯","evidence":"skill-matrix-v1 competencies and source locators; curriculum assessment evidence","result":"pass"},{"reference":"CVTE supply chain equipment requirements","version":"test-2026","requirement":"机器人工作站、PLC/I/O与数字孪生映射可验证","evidence":"work-order resources; sim asset and hardware_mapping; validation logs","result":"pass"},{"reference":"Dachen safety gate","version":"1.0.0","requirement":"急停、联锁、默认安全态、隔离和恢复路径覆盖","evidence":"WO safety_controls; SIM checkpoints and validation","result":"pass"}],"remediation":[],"review":{"auditor":"DACHEN-AGENT-SAFETY-05","reviewed_at":"2026-09-17T06:13:10Z","evidence_complete":true,"veto_applied":false}},"tracking_chain":["JOB-ROBOT-001 -> COMP-ROBOT-DT -> MOD-ROBOT-DT -> SCN-ROBOT-DT -> WO-ROBOT-DT -> SIM-ROBOT-DT -> AUDIT-ROBOT-001"]}